{"$schema":"https://json-schema.org/draft/2020-12/schema","$id":"ox-genesis-identity-1.schema.json","title":"OriginX Genesis Identity","type":"object","additionalProperties":false,"required":["identityVersion","tokenId","serial","canonicalName","title","tier","cohort","era","structureProfileEra","generationVersion","generationTheme","dna","dnaHash","seed","seedHash","modelBinding"],"properties":{"identityVersion":{"const":"OX-GENESIS-IDENTITY-1"},"tokenId":{"type":"integer","minimum":1,"maximum":1000},"serial":{"type":"string","pattern":"^#[0-9]{4}$"},"canonicalName":{"type":"string","minLength":3},"title":{"type":"string","minLength":3},"tier":{"const":"LEGENDARY"},"cohort":{"const":"GENESIS"},"era":{"const":"PRIMORDIAL ORIGIN"},"structureProfileEra":{"const":"Ascended Origin"},"generationVersion":{"const":"OX-GENESIS-GENERATION-1"},"generationTheme":{"const":"Genesis / Primordial Origin"},"dna":{"type":"object"},"dnaHash":{"type":"string","pattern":"^sha256:[0-9a-f]{64}$"},"seed":{"type":"integer","minimum":0},"seedHash":{"type":"string","pattern":"^sha256:[0-9a-f]{64}$"},"modelBinding":{"type":"object"}}}
