{"canonicalName":"Oryxath Megalith","cohort":"GENESIS","dna":{"archetype":"primordial-colossal-dragon","augmentation":"ancient-proto-technology","bodyStructure":"colossal-grounded","dnaVersion":"OX-GENESIS-DNA-1","environment":"basalt-origin-citadel","hornArchitecture":"forward-megalithic-crown","lightingProfile":"deep-crimson-forge-rim","lineage":{"cohort":"GENESIS","era":"PRIMORDIAL ORIGIN","index":6,"maximumSupply":1000,"tier":"LEGENDARY"},"poseProfile":"grounded-apex-stance","primaryMaterial":"basalt","secondaryMaterial":"dark-forged-metal","wingGeometry":"massive-ribbed-vault"},"dnaHash":"sha256:971eb67a5cab407c21a0b1a33b8dd280a369aaab520975723b55ee94e91389f2","era":"PRIMORDIAL ORIGIN","generationTheme":"Genesis / Primordial Origin","generationVersion":"OX-GENESIS-GENERATION-1","identityVersion":"OX-GENESIS-IDENTITY-1","modelBinding":{"modelHash":"sha256:b8944e9fe0b69b36ae1b5bb0185b3a7b8ef14347fe0fa9af6c64c4829022261f","modelId":"OX-MODEL-002","productionAlias":"OX-GENESIS-MODEL-1","status":"CANDIDATE_PENDING_GENESIS_GATE"},"seed":12289992856158691312,"seedHash":"sha256:7b6ae5c3debbb9669547d49525734c05df0c3ec384989a61318c5bb573714501","serial":"#0006","structureProfileEra":"Ascended Origin","tier":"LEGENDARY","title":"Guardian of the Megalith Gate","tokenId":6}