{"canonicalName":"Vaeltharos Monolith","cohort":"GENESIS","dna":{"archetype":"primordial-colossal-dragon","augmentation":"ancient-proto-technology","bodyStructure":"monumental-serpentine","dnaVersion":"OX-GENESIS-DNA-1","environment":"mineral-fog-megalith-field","hornArchitecture":"radial-basal-arches","lightingProfile":"subsurface-mineral-glow","lineage":{"cohort":"GENESIS","era":"PRIMORDIAL ORIGIN","index":2,"maximumSupply":1000,"tier":"LEGENDARY"},"poseProfile":"low-crouched-storm-defiance","primaryMaterial":"basalt","secondaryMaterial":"dark-forged-metal","wingGeometry":"cathedral-buttress-wing"},"dnaHash":"sha256:c42be7b46c48e0d4a98e2fb806740b55455505d7b4329cc0d85862d8995d5b3a","era":"PRIMORDIAL ORIGIN","generationTheme":"Genesis / Primordial Origin","generationVersion":"OX-GENESIS-GENERATION-1","identityVersion":"OX-GENESIS-IDENTITY-1","modelBinding":{"modelHash":"sha256:b8944e9fe0b69b36ae1b5bb0185b3a7b8ef14347fe0fa9af6c64c4829022261f","modelId":"OX-MODEL-002","productionAlias":"OX-GENESIS-MODEL-1","status":"CANDIDATE_PENDING_GENESIS_GATE"},"seed":6546531190901250070,"seedHash":"sha256:8b8981db1fc61b676b499bbeed1f1f4ffc9bb729fd76412471bf017381d22d03","serial":"#0002","structureProfileEra":"Ascended Origin","tier":"LEGENDARY","title":"Keeper of the First Monolith","tokenId":2}