{"canonicalName":"Nytherion Basalt Crown","cohort":"GENESIS","dna":{"archetype":"primordial-colossal-dragon","augmentation":"ancient-proto-technology","bodyStructure":"fortress-backed","dnaVersion":"OX-GENESIS-DNA-1","environment":"cyclopean-storm-sanctum","hornArchitecture":"layered-obsidian-buttresses","lightingProfile":"cold-storm-toplight","lineage":{"cohort":"GENESIS","era":"PRIMORDIAL ORIGIN","index":4,"maximumSupply":1000,"tier":"LEGENDARY"},"poseProfile":"ascending-megalithic-profile","primaryMaterial":"basalt","secondaryMaterial":"weathered-stone","wingGeometry":"broad-basalt-fan"},"dnaHash":"sha256:f6364cf2316318483f2c8eaee4007029b9393c13e5fffbbae12d9b5e4e487def","era":"PRIMORDIAL ORIGIN","generationTheme":"Genesis / Primordial Origin","generationVersion":"OX-GENESIS-GENERATION-1","identityVersion":"OX-GENESIS-IDENTITY-1","modelBinding":{"modelHash":"sha256:b8944e9fe0b69b36ae1b5bb0185b3a7b8ef14347fe0fa9af6c64c4829022261f","modelId":"OX-MODEL-002","productionAlias":"OX-GENESIS-MODEL-1","status":"CANDIDATE_PENDING_GENESIS_GATE"},"seed":619885554085082306,"seedHash":"sha256:0da3862757253f086c65d57a04dd00caf65deb0797821a97ec1c78bd723797be","serial":"#0004","structureProfileEra":"Ascended Origin","tier":"LEGENDARY","title":"Sovereign of the Basalt Crown","tokenId":4}