{"canonicalName":"Vyrnathos the Origin Seal","cohort":"GENESIS","dna":{"archetype":"primordial-colossal-dragon","augmentation":"ancient-proto-technology","bodyStructure":"ancient-predatory","dnaVersion":"OX-GENESIS-DNA-1","environment":"obsidian-foundation-chasm","hornArchitecture":"swept-architectural-blades","lightingProfile":"eclipse-backlight","lineage":{"cohort":"GENESIS","era":"PRIMORDIAL ORIGIN","index":10,"maximumSupply":1000,"tier":"LEGENDARY"},"poseProfile":"wings-raised-foundation-pose","primaryMaterial":"basalt","secondaryMaterial":"weathered-stone","wingGeometry":"segmented-forged-membrane"},"dnaHash":"sha256:eae4083d2c95aef416944807cd3248d25531398181d338a5c4c57cea264c6dbd","era":"PRIMORDIAL ORIGIN","generationTheme":"Genesis / Primordial Origin","generationVersion":"OX-GENESIS-GENERATION-1","identityVersion":"OX-GENESIS-IDENTITY-1","modelBinding":{"modelHash":"sha256:b8944e9fe0b69b36ae1b5bb0185b3a7b8ef14347fe0fa9af6c64c4829022261f","modelId":"OX-MODEL-002","productionAlias":"OX-GENESIS-MODEL-1","status":"CANDIDATE_PENDING_GENESIS_GATE"},"seed":3674790545803592422,"seedHash":"sha256:fa8b9b262dc06200d4dd51f877b9bab8bf2da5e50b3b54e259bc82d261f7d940","serial":"#0010","structureProfileEra":"Ascended Origin","tier":"LEGENDARY","title":"Bearer of the Origin Seal","tokenId":10}