{"canonicalName":"Drakorym the Foundation","cohort":"GENESIS","dna":{"archetype":"primordial-colossal-dragon","augmentation":"ancient-proto-technology","bodyStructure":"ancient-predatory","dnaVersion":"OX-GENESIS-DNA-1","environment":"obsidian-foundation-chasm","hornArchitecture":"swept-architectural-blades","lightingProfile":"eclipse-backlight","lineage":{"cohort":"GENESIS","era":"PRIMORDIAL ORIGIN","index":5,"maximumSupply":1000,"tier":"LEGENDARY"},"poseProfile":"wings-raised-foundation-pose","primaryMaterial":"obsidian","secondaryMaterial":"dark-forged-metal","wingGeometry":"segmented-forged-membrane"},"dnaHash":"sha256:89bcc027bf2f08092b3d78b2b4c1e6888dcdb6a1fcae21363cbf70d644ffe178","era":"PRIMORDIAL ORIGIN","generationTheme":"Genesis / Primordial Origin","generationVersion":"OX-GENESIS-GENERATION-1","identityVersion":"OX-GENESIS-IDENTITY-1","modelBinding":{"modelHash":"sha256:b8944e9fe0b69b36ae1b5bb0185b3a7b8ef14347fe0fa9af6c64c4829022261f","modelId":"OX-MODEL-002","productionAlias":"OX-GENESIS-MODEL-1","status":"CANDIDATE_PENDING_GENESIS_GATE"},"seed":4655466092573055295,"seedHash":"sha256:a94584b8f347a4e30887c4e0c221e82edba6cc1f440b29c73c1ef6ae6ad0f735","serial":"#0005","structureProfileEra":"Ascended Origin","tier":"LEGENDARY","title":"Architect of the Ancient Deep","tokenId":5}