{"canonicalName":"Kaelzaryn Storm Reliquary","cohort":"GENESIS","dna":{"archetype":"primordial-colossal-dragon","augmentation":"ancient-proto-technology","bodyStructure":"fortress-backed","dnaVersion":"OX-GENESIS-DNA-1","environment":"cyclopean-storm-sanctum","hornArchitecture":"layered-obsidian-buttresses","lightingProfile":"cold-storm-toplight","lineage":{"cohort":"GENESIS","era":"PRIMORDIAL ORIGIN","index":9,"maximumSupply":1000,"tier":"LEGENDARY"},"poseProfile":"ascending-megalithic-profile","primaryMaterial":"obsidian","secondaryMaterial":"dark-forged-metal","wingGeometry":"broad-basalt-fan"},"dnaHash":"sha256:2fe66beaab57c62a43c435c7b6cf01d2c06254f922f708f29a4ca39437f761d8","era":"PRIMORDIAL ORIGIN","generationTheme":"Genesis / Primordial Origin","generationVersion":"OX-GENESIS-GENERATION-1","identityVersion":"OX-GENESIS-IDENTITY-1","modelBinding":{"modelHash":"sha256:b8944e9fe0b69b36ae1b5bb0185b3a7b8ef14347fe0fa9af6c64c4829022261f","modelId":"OX-MODEL-002","productionAlias":"OX-GENESIS-MODEL-1","status":"CANDIDATE_PENDING_GENESIS_GATE"},"seed":777029209423424260,"seedHash":"sha256:b684efe2da60c30b9da893ce7735b95ac4492e9c297de81d28ff3665f1cdfbcb","serial":"#0009","structureProfileEra":"Ascended Origin","tier":"LEGENDARY","title":"Herald of the Founding Storm","tokenId":9}