{"canonicalName":"Tharokh Obsidian Wing","cohort":"GENESIS","dna":{"archetype":"primordial-colossal-dragon","augmentation":"ancient-proto-technology","bodyStructure":"massive-broad-chested","dnaVersion":"OX-GENESIS-DNA-1","environment":"ash-covered-proto-forge","hornArchitecture":"asymmetric-cathedral-spires","lightingProfile":"restrained-cyan-rim","lineage":{"cohort":"GENESIS","era":"PRIMORDIAL ORIGIN","index":8,"maximumSupply":1000,"tier":"LEGENDARY"},"poseProfile":"monumental-three-quarter-guard","primaryMaterial":"basalt","secondaryMaterial":"dark-forged-metal","wingGeometry":"weathered-monumental-sail"},"dnaHash":"sha256:91fae8aadc6c9696de3385252865d54ea4bc296f9c1512d7ceb3c209c376ce81","era":"PRIMORDIAL ORIGIN","generationTheme":"Genesis / Primordial Origin","generationVersion":"OX-GENESIS-GENERATION-1","identityVersion":"OX-GENESIS-IDENTITY-1","modelBinding":{"modelHash":"sha256:b8944e9fe0b69b36ae1b5bb0185b3a7b8ef14347fe0fa9af6c64c4829022261f","modelId":"OX-MODEL-002","productionAlias":"OX-GENESIS-MODEL-1","status":"CANDIDATE_PENDING_GENESIS_GATE"},"seed":18362869483189722553,"seedHash":"sha256:643b9e3dd541c3569938afd2ca087408536ce12f95f7bc24aa41a613a52a2caf","serial":"#0008","structureProfileEra":"Ascended Origin","tier":"LEGENDARY","title":"Warden of the Obsidian Firmament","tokenId":8}