{"canonicalName":"Zhaevor Ash Sovereign","cohort":"GENESIS","dna":{"archetype":"primordial-colossal-dragon","augmentation":"ancient-proto-technology","bodyStructure":"monumental-serpentine","dnaVersion":"OX-GENESIS-DNA-1","environment":"mineral-fog-megalith-field","hornArchitecture":"radial-basal-arches","lightingProfile":"subsurface-mineral-glow","lineage":{"cohort":"GENESIS","era":"PRIMORDIAL ORIGIN","index":7,"maximumSupply":1000,"tier":"LEGENDARY"},"poseProfile":"low-crouched-storm-defiance","primaryMaterial":"obsidian","secondaryMaterial":"weathered-stone","wingGeometry":"cathedral-buttress-wing"},"dnaHash":"sha256:cf97354371885381f46bbc09d1edbd3e7c0dde2044e4e742b3b2dc974fa0349d","era":"PRIMORDIAL ORIGIN","generationTheme":"Genesis / Primordial Origin","generationVersion":"OX-GENESIS-GENERATION-1","identityVersion":"OX-GENESIS-IDENTITY-1","modelBinding":{"modelHash":"sha256:b8944e9fe0b69b36ae1b5bb0185b3a7b8ef14347fe0fa9af6c64c4829022261f","modelId":"OX-MODEL-002","productionAlias":"OX-GENESIS-MODEL-1","status":"CANDIDATE_PENDING_GENESIS_GATE"},"seed":4931763405037286864,"seedHash":"sha256:58783b196a743dd8e0b876dfa645032925e88d991b43972b30398b4352cb7977","serial":"#0007","structureProfileEra":"Ascended Origin","tier":"LEGENDARY","title":"The Ash-Bound Origin","tokenId":7}