{"canonicalName":"Azhurak Primordialis","cohort":"GENESIS","dna":{"archetype":"primordial-colossal-dragon","augmentation":"ancient-proto-technology","bodyStructure":"colossal-grounded","dnaVersion":"OX-GENESIS-DNA-1","environment":"basalt-origin-citadel","hornArchitecture":"forward-megalithic-crown","lightingProfile":"deep-crimson-forge-rim","lineage":{"cohort":"GENESIS","era":"PRIMORDIAL ORIGIN","index":1,"maximumSupply":1000,"tier":"LEGENDARY"},"poseProfile":"grounded-apex-stance","primaryMaterial":"obsidian","secondaryMaterial":"weathered-stone","wingGeometry":"massive-ribbed-vault"},"dnaHash":"sha256:c775e62b4bdd2feee5c587f4c8cd227a7d374b7121937194a9cf902d7efafe53","era":"PRIMORDIAL ORIGIN","generationTheme":"Genesis / Primordial Origin","generationVersion":"OX-GENESIS-GENERATION-1","identityVersion":"OX-GENESIS-IDENTITY-1","modelBinding":{"modelHash":"sha256:b8944e9fe0b69b36ae1b5bb0185b3a7b8ef14347fe0fa9af6c64c4829022261f","modelId":"OX-MODEL-002","productionAlias":"OX-GENESIS-MODEL-1","status":"CANDIDATE_PENDING_GENESIS_GATE"},"seed":14993452400554643706,"seedHash":"sha256:c584b8f1432b827c3ce9b2e0b802c87a3cc67278465ffcb5cf27294d7d4233b5","serial":"#0001","structureProfileEra":"Ascended Origin","tier":"LEGENDARY","title":"The Primordial Witness","tokenId":1}