{"canonicalName":"Korvaxion the First Ember","cohort":"GENESIS","dna":{"archetype":"primordial-colossal-dragon","augmentation":"ancient-proto-technology","bodyStructure":"massive-broad-chested","dnaVersion":"OX-GENESIS-DNA-1","environment":"ash-covered-proto-forge","hornArchitecture":"asymmetric-cathedral-spires","lightingProfile":"restrained-cyan-rim","lineage":{"cohort":"GENESIS","era":"PRIMORDIAL ORIGIN","index":3,"maximumSupply":1000,"tier":"LEGENDARY"},"poseProfile":"monumental-three-quarter-guard","primaryMaterial":"obsidian","secondaryMaterial":"dark-forged-metal","wingGeometry":"weathered-monumental-sail"},"dnaHash":"sha256:e5064acd8eaabe263f432141933087b03df06b944897e784eb30dc2085bfce9b","era":"PRIMORDIAL ORIGIN","generationTheme":"Genesis / Primordial Origin","generationVersion":"OX-GENESIS-GENERATION-1","identityVersion":"OX-GENESIS-IDENTITY-1","modelBinding":{"modelHash":"sha256:b8944e9fe0b69b36ae1b5bb0185b3a7b8ef14347fe0fa9af6c64c4829022261f","modelId":"OX-MODEL-002","productionAlias":"OX-GENESIS-MODEL-1","status":"CANDIDATE_PENDING_GENESIS_GATE"},"seed":3559508881406427834,"seedHash":"sha256:8f4b6f350f05aec0428a10cea775b6c9e228fbdb8660e984d72b893ff6929a05","serial":"#0003","structureProfileEra":"Ascended Origin","tier":"LEGENDARY","title":"Bearer of the Foundation Flame","tokenId":3}